{
  "schema_version": "3.0",
  "runtime_id": "codex",
  "runtime_name": "Codex",
  "install_availability": "INSTALLED",
  "adapter_support": "NATIVE_IMPLEMENTED",
  "static_contract": "VERIFIED",
  "live_execution": "TRANSPORT_BLOCKED",
  "projection_modes": ["STATIC_METADATA", "SELECTED_ONLY"],
  "selected_only_skill_support": "NATIVE",
  "permission_projection_support": "NATIVE_EXACT",
  "model_selection_surface": "KNOWN",
  "effort_selection_surface": "KNOWN",
  "mcp_support": "NATIVE",
  "plugin_support": "NATIVE",
  "observed_runtime_version": "0.153.4",
  "release_tag": "rust-v0.153.4",
  "release_commit": "3d2ee51ca2d5db578f328aa75e20aa22c0197c9a",
  "runtime_contract_digest": "sha256:692da7699367f6f4fbbd46c0021278c1311440bcebf0bcb9b836690c05e56196",
  "adapter_manifest_path": "fixtures/v3/agents/codex.json",
  "native_contract_path": "fixtures/v3/codex/codex-native-config-contract.json",
  "evidence_refs": [
    "docs/v3/evidence/RUNTIME_CAPABILITY_MATRIX.md",
    "docs/v3/evidence/PHASE26_RUNTIME_PROVENANCE_ROUTE.md",
    "docs/v3/evidence/MODEL_RUNTIME_EVAL_V9.md"
  ]
}
